cauhoi,traloi
Cho em hỏi Honor X8A 8GB-128GB  cũ 128gb khoảng bao nhiêu ạ?,Dạ sản phẩm này bên Shop hiện tại không kinh doanh ạ. Mình vui lòng tham khảo các sản phẩm khác tương tự nhé. Để được hỗ trợ chi tiết hơn về sản phẩm quý khách liên hệ tổng đài miễn phí 18006601 ạ.
Cho em hỏi Samsung Galaxy A05s 128GB  cũ 128gb khoảng bao nhiêu ạ?,Dạ sản phẩm này bên Shop hiện tại không kinh doanh ạ. Mình vui lòng tham khảo các sản phẩm khác tương tự nhé. Để được hỗ trợ chi tiết hơn về sản phẩm quý khách liên hệ tổng đài miễn phí 18006601 ạ.
Cho em hỏi OPPO Reno10 5G 256GB  cũ 256gb khoảng bao nhiêu ạ?,Dạ sản phẩm này bên Shop hiện tại không kinh doanh ạ. Mình vui lòng tham khảo các sản phẩm khác tương tự nhé. Để được hỗ trợ chi tiết hơn về sản phẩm quý khách liên hệ tổng đài miễn phí 18006601 ạ.
Cho em hỏi Samsung Galaxy Z Flip4 5G 128GB  cũ 128gb khoảng bao nhiêu ạ?,Dạ sản phẩm này bên Shop hiện tại không kinh doanh ạ. Mình vui lòng tham khảo các sản phẩm khác tương tự nhé. Để được hỗ trợ chi tiết hơn về sản phẩm quý khách liên hệ tổng đài miễn phí 18006601 ạ.
Cho em hỏi Samsung Galaxy A34 5G  cũ 128gb khoảng bao nhiêu ạ?,Dạ sản phẩm này bên Shop hiện tại không kinh doanh ạ. Mình vui lòng tham khảo các sản phẩm khác tương tự nhé. Để được hỗ trợ chi tiết hơn về sản phẩm quý khách liên hệ tổng đài miễn phí 18006601 ạ.
Cho em hỏi realme C55 6GB-128GB  cũ 128gb khoảng bao nhiêu ạ?,Dạ sản phẩm này bên Shop hiện tại không kinh doanh ạ. Mình vui lòng tham khảo các sản phẩm khác tương tự nhé. Để được hỗ trợ chi tiết hơn về sản phẩm quý khách liên hệ tổng đài miễn phí 18006601 ạ.
Cho em hỏi OPPO A58 6GB-128GB  cũ 128gb khoảng bao nhiêu ạ?,Dạ sản phẩm này bên Shop hiện tại không kinh doanh ạ. Mình vui lòng tham khảo các sản phẩm khác tương tự nhé. Để được hỗ trợ chi tiết hơn về sản phẩm quý khách liên hệ tổng đài miễn phí 18006601 ạ.
Cho em hỏi Samsung Galaxy Z Flip5 5G 256GB  cũ 256gb khoảng bao nhiêu ạ?,Dạ sản phẩm này bên Shop hiện tại không kinh doanh ạ. Mình vui lòng tham khảo các sản phẩm khác tương tự nhé. Để được hỗ trợ chi tiết hơn về sản phẩm quý khách liên hệ tổng đài miễn phí 18006601 ạ.
Cho em hỏi Xiaomi 13 Lite 8GB-128GB  cũ 128gb khoảng bao nhiêu ạ?,Dạ sản phẩm này bên Shop hiện tại không kinh doanh ạ. Mình vui lòng tham khảo các sản phẩm khác tương tự nhé. Để được hỗ trợ chi tiết hơn về sản phẩm quý khách liên hệ tổng đài miễn phí 18006601 ạ.
Cho em hỏi OPPO A55 4GB-64GB  cũ 64gb khoảng bao nhiêu ạ?,Dạ sản phẩm này bên Shop hiện tại không kinh doanh ạ. Mình vui lòng tham khảo các sản phẩm khác tương tự nhé. Để được hỗ trợ chi tiết hơn về sản phẩm quý khách liên hệ tổng đài miễn phí 18006601 ạ.
Cho em hỏi OPPO A17k 3GB-64GB  cũ 64gb khoảng bao nhiêu ạ?,Dạ sản phẩm này bên Shop hiện tại không kinh doanh ạ. Mình vui lòng tham khảo các sản phẩm khác tương tự nhé. Để được hỗ trợ chi tiết hơn về sản phẩm quý khách liên hệ tổng đài miễn phí 18006601 ạ.
Cho em hỏi Samsung Galaxy A14 4G  cũ 128gb khoảng bao nhiêu ạ?,Dạ sản phẩm này bên Shop hiện tại không kinh doanh ạ. Mình vui lòng tham khảo các sản phẩm khác tương tự nhé. Để được hỗ trợ chi tiết hơn về sản phẩm quý khách liên hệ tổng đài miễn phí 18006601 ạ.
Cho em hỏi Samsung Galaxy A04  cũ 32gb khoảng bao nhiêu ạ?,Dạ sản phẩm này bên Shop hiện tại không kinh doanh ạ. Mình vui lòng tham khảo các sản phẩm khác tương tự nhé. Để được hỗ trợ chi tiết hơn về sản phẩm quý khách liên hệ tổng đài miễn phí 18006601 ạ.
Cho em hỏi Xiaomi Redmi 12C 4GB - 64GB  cũ 64gb khoảng bao nhiêu ạ?,Dạ sản phẩm này bên Shop hiện tại không kinh doanh ạ. Mình vui lòng tham khảo các sản phẩm khác tương tự nhé. Để được hỗ trợ chi tiết hơn về sản phẩm quý khách liên hệ tổng đài miễn phí 18006601 ạ.
Cho em hỏi Xiaomi Redmi 10A 3GB-64GB  cũ 64gb khoảng bao nhiêu ạ?,Dạ sản phẩm này bên Shop hiện tại không kinh doanh ạ. Mình vui lòng tham khảo các sản phẩm khác tương tự nhé. Để được hỗ trợ chi tiết hơn về sản phẩm quý khách liên hệ tổng đài miễn phí 18006601 ạ.
Cho em hỏi realme C51 4GB-128GB  cũ 128gb khoảng bao nhiêu ạ?,Dạ sản phẩm này bên Shop hiện tại không kinh doanh ạ. Mình vui lòng tham khảo các sản phẩm khác tương tự nhé. Để được hỗ trợ chi tiết hơn về sản phẩm quý khách liên hệ tổng đài miễn phí 18006601 ạ.
Cho em hỏi Honor X7A 6GB-128GB  cũ 128gb khoảng bao nhiêu ạ?,Dạ sản phẩm này bên Shop hiện tại không kinh doanh ạ. Mình vui lòng tham khảo các sản phẩm khác tương tự nhé. Để được hỗ trợ chi tiết hơn về sản phẩm quý khách liên hệ tổng đài miễn phí 18006601 ạ.
Cho em hỏi Honor X6A 4GB-128GB  cũ 128gb khoảng bao nhiêu ạ?,Dạ sản phẩm này bên Shop hiện tại không kinh doanh ạ. Mình vui lòng tham khảo các sản phẩm khác tương tự nhé. Để được hỗ trợ chi tiết hơn về sản phẩm quý khách liên hệ tổng đài miễn phí 18006601 ạ.
Cho em hỏi Asus ROG Phone 7 16GB-512GB  cũ 512gb khoảng bao nhiêu ạ?,Dạ sản phẩm này bên Shop hiện tại không kinh doanh ạ. Mình vui lòng tham khảo các sản phẩm khác tương tự nhé. Để được hỗ trợ chi tiết hơn về sản phẩm quý khách liên hệ tổng đài miễn phí 18006601 ạ.
Cho em hỏi Asus ROG Phone 6 12GB-256GB  cũ 256gb khoảng bao nhiêu ạ?,Dạ sản phẩm này bên Shop hiện tại không kinh doanh ạ. Mình vui lòng tham khảo các sản phẩm khác tương tự nhé. Để được hỗ trợ chi tiết hơn về sản phẩm quý khách liên hệ tổng đài miễn phí 18006601 ạ.
Cho em hỏi Vivo Y22s 8GB-128GB  cũ 128gb khoảng bao nhiêu ạ?,Dạ sản phẩm này bên Shop hiện tại không kinh doanh ạ. Mình vui lòng tham khảo các sản phẩm khác tương tự nhé. Để được hỗ trợ chi tiết hơn về sản phẩm quý khách liên hệ tổng đài miễn phí 18006601 ạ.
Cho em hỏi Vivo Y16 4GB-128GB  cũ 128gb khoảng bao nhiêu ạ?,Dạ sản phẩm này bên Shop hiện tại không kinh doanh ạ. Mình vui lòng tham khảo các sản phẩm khác tương tự nhé. Để được hỗ trợ chi tiết hơn về sản phẩm quý khách liên hệ tổng đài miễn phí 18006601 ạ.
Cho em hỏi Samsung Galaxy Z Fold4 5G 256GB  cũ 256gb khoảng bao nhiêu ạ?,Dạ sản phẩm này bên Shop hiện tại không kinh doanh ạ. Mình vui lòng tham khảo các sản phẩm khác tương tự nhé. Để được hỗ trợ chi tiết hơn về sản phẩm quý khách liên hệ tổng đài miễn phí 18006601 ạ.
Cho em hỏi iPhone 12 64GB  cũ 64gb khoảng bao nhiêu ạ?,Dạ sản phẩm này bên Shop hiện tại không kinh doanh ạ. Mình vui lòng tham khảo các sản phẩm khác tương tự nhé. Để được hỗ trợ chi tiết hơn về sản phẩm quý khách liên hệ tổng đài miễn phí 18006601 ạ.
Cho em hỏi iPhone 11 64GB  cũ 64gb khoảng bao nhiêu ạ?,Dạ sản phẩm này bên Shop hiện tại không kinh doanh ạ. Mình vui lòng tham khảo các sản phẩm khác tương tự nhé. Để được hỗ trợ chi tiết hơn về sản phẩm quý khách liên hệ tổng đài miễn phí 18006601 ạ.
Cho em hỏi Samsung Galaxy A54 5G 128GB  cũ 128gb khoảng bao nhiêu ạ?,Dạ sản phẩm này bên Shop hiện tại không kinh doanh ạ. Mình vui lòng tham khảo các sản phẩm khác tương tự nhé. Để được hỗ trợ chi tiết hơn về sản phẩm quý khách liên hệ tổng đài miễn phí 18006601 ạ.
Cho em hỏi Samsung Galaxy A53 5G 256GB  cũ 256gb khoảng bao nhiêu ạ?,Dạ sản phẩm này bên Shop hiện tại không kinh doanh ạ. Mình vui lòng tham khảo các sản phẩm khác tương tự nhé. Để được hỗ trợ chi tiết hơn về sản phẩm quý khách liên hệ tổng đài miễn phí 18006601 ạ.
Cho em hỏi OPPO A78 8GB-256GB  cũ 256gb khoảng bao nhiêu ạ?,Dạ sản phẩm này bên Shop hiện tại không kinh doanh ạ. Mình vui lòng tham khảo các sản phẩm khác tương tự nhé. Để được hỗ trợ chi tiết hơn về sản phẩm quý khách liên hệ tổng đài miễn phí 18006601 ạ.
Cho em hỏi OPPO A77s 8GB-128GB  cũ 128gb khoảng bao nhiêu ạ?,Dạ sản phẩm này bên Shop hiện tại không kinh doanh ạ. Mình vui lòng tham khảo các sản phẩm khác tương tự nhé. Để được hỗ trợ chi tiết hơn về sản phẩm quý khách liên hệ tổng đài miễn phí 18006601 ạ.
Cho em hỏi Samsung Galaxy A14 5G  cũ 128gb khoảng bao nhiêu ạ?,Dạ sản phẩm này bên Shop hiện tại không kinh doanh ạ. Mình vui lòng tham khảo các sản phẩm khác tương tự nhé. Để được hỗ trợ chi tiết hơn về sản phẩm quý khách liên hệ tổng đài miễn phí 18006601 ạ.
Cho em hỏi Xiaomi Redmi Note 11 4GB - 128GB  cũ 128gb khoảng bao nhiêu ạ?,Dạ sản phẩm này bên Shop hiện tại không kinh doanh ạ. Mình vui lòng tham khảo các sản phẩm khác tương tự nhé. Để được hỗ trợ chi tiết hơn về sản phẩm quý khách liên hệ tổng đài miễn phí 18006601 ạ.
Cho em hỏi OPPO A57 4GB-128GB  cũ 128gb khoảng bao nhiêu ạ?,Dạ sản phẩm này bên Shop hiện tại không kinh doanh ạ. Mình vui lòng tham khảo các sản phẩm khác tương tự nhé. Để được hỗ trợ chi tiết hơn về sản phẩm quý khách liên hệ tổng đài miễn phí 18006601 ạ.
Cho em hỏi Xiaomi Redmi 10 2022 4GB-128GB  cũ 128gb khoảng bao nhiêu ạ?,Dạ sản phẩm này bên Shop hiện tại không kinh doanh ạ. Mình vui lòng tham khảo các sản phẩm khác tương tự nhé. Để được hỗ trợ chi tiết hơn về sản phẩm quý khách liên hệ tổng đài miễn phí 18006601 ạ.
Cho em hỏi Samsung Galaxy A04s  cũ 64gb khoảng bao nhiêu ạ?,Dạ sản phẩm này bên Shop hiện tại không kinh doanh ạ. Mình vui lòng tham khảo các sản phẩm khác tương tự nhé. Để được hỗ trợ chi tiết hơn về sản phẩm quý khách liên hệ tổng đài miễn phí 18006601 ạ.
Cho em hỏi Vivo Y15s 3GB - 32GB  cũ 32gb khoảng bao nhiêu ạ?,Dạ sản phẩm này bên Shop hiện tại không kinh doanh ạ. Mình vui lòng tham khảo các sản phẩm khác tương tự nhé. Để được hỗ trợ chi tiết hơn về sản phẩm quý khách liên hệ tổng đài miễn phí 18006601 ạ.
Cho em hỏi Samsung Galaxy Z Fold5 5G 256GB  cũ 256gb khoảng bao nhiêu ạ?,Dạ sản phẩm này bên Shop hiện tại không kinh doanh ạ. Mình vui lòng tham khảo các sản phẩm khác tương tự nhé. Để được hỗ trợ chi tiết hơn về sản phẩm quý khách liên hệ tổng đài miễn phí 18006601 ạ.
Cho em hỏi iPhone 15 Pro 128GB  cũ 128gb khoảng bao nhiêu ạ?,Dạ sản phẩm này bên Shop hiện tại không kinh doanh ạ. Mình vui lòng tham khảo các sản phẩm khác tương tự nhé. Để được hỗ trợ chi tiết hơn về sản phẩm quý khách liên hệ tổng đài miễn phí 18006601 ạ.
Cho em hỏi iPhone 14 Pro Max 128GB  cũ 128gb khoảng bao nhiêu ạ?,Dạ sản phẩm này bên Shop hiện tại không kinh doanh ạ. Mình vui lòng tham khảo các sản phẩm khác tương tự nhé. Để được hỗ trợ chi tiết hơn về sản phẩm quý khách liên hệ tổng đài miễn phí 18006601 ạ.
Cho em hỏi iPhone 15 Plus 128GB  cũ 128gb khoảng bao nhiêu ạ?,Dạ sản phẩm này bên Shop hiện tại không kinh doanh ạ. Mình vui lòng tham khảo các sản phẩm khác tương tự nhé. Để được hỗ trợ chi tiết hơn về sản phẩm quý khách liên hệ tổng đài miễn phí 18006601 ạ.
Cho em hỏi iPhone 14 Pro 128GB  cũ 128gb khoảng bao nhiêu ạ?,Dạ sản phẩm này bên Shop hiện tại không kinh doanh ạ. Mình vui lòng tham khảo các sản phẩm khác tương tự nhé. Để được hỗ trợ chi tiết hơn về sản phẩm quý khách liên hệ tổng đài miễn phí 18006601 ạ.
Cho em hỏi iPhone 15 128GB  cũ 128gb khoảng bao nhiêu ạ?,Dạ sản phẩm này bên Shop hiện tại không kinh doanh ạ. Mình vui lòng tham khảo các sản phẩm khác tương tự nhé. Để được hỗ trợ chi tiết hơn về sản phẩm quý khách liên hệ tổng đài miễn phí 18006601 ạ.
Cho em hỏi iPhone 14 Plus 128GB  cũ 128gb khoảng bao nhiêu ạ?,Dạ sản phẩm này bên Shop hiện tại không kinh doanh ạ. Mình vui lòng tham khảo các sản phẩm khác tương tự nhé. Để được hỗ trợ chi tiết hơn về sản phẩm quý khách liên hệ tổng đài miễn phí 18006601 ạ.
Cho em hỏi Samsung Galaxy S23 Plus 5G 256GB  cũ 256gb khoảng bao nhiêu ạ?,Dạ sản phẩm này bên Shop hiện tại không kinh doanh ạ. Mình vui lòng tham khảo các sản phẩm khác tương tự nhé. Để được hỗ trợ chi tiết hơn về sản phẩm quý khách liên hệ tổng đài miễn phí 18006601 ạ.
Cho em hỏi OPPO Find N2 Flip  cũ 256gb khoảng bao nhiêu ạ?,Dạ sản phẩm này bên Shop hiện tại không kinh doanh ạ. Mình vui lòng tham khảo các sản phẩm khác tương tự nhé. Để được hỗ trợ chi tiết hơn về sản phẩm quý khách liên hệ tổng đài miễn phí 18006601 ạ.
Cho em hỏi Asus ROG 6 DIABLO 16GB-512GB  cũ 512gb khoảng bao nhiêu ạ?,Dạ sản phẩm này bên Shop hiện tại không kinh doanh ạ. Mình vui lòng tham khảo các sản phẩm khác tương tự nhé. Để được hỗ trợ chi tiết hơn về sản phẩm quý khách liên hệ tổng đài miễn phí 18006601 ạ.
Cho em hỏi Samsung Galaxy S23 5G 256GB  cũ 256gb khoảng bao nhiêu ạ?,Dạ sản phẩm này bên Shop hiện tại không kinh doanh ạ. Mình vui lòng tham khảo các sản phẩm khác tương tự nhé. Để được hỗ trợ chi tiết hơn về sản phẩm quý khách liên hệ tổng đài miễn phí 18006601 ạ.
Cho em hỏi iPhone 14 128GB  cũ 128gb khoảng bao nhiêu ạ?,Dạ sản phẩm này bên Shop hiện tại không kinh doanh ạ. Mình vui lòng tham khảo các sản phẩm khác tương tự nhé. Để được hỗ trợ chi tiết hơn về sản phẩm quý khách liên hệ tổng đài miễn phí 18006601 ạ.
Cho em hỏi iPhone 13 128GB  cũ 128gb khoảng bao nhiêu ạ?,Dạ sản phẩm này bên Shop hiện tại không kinh doanh ạ. Mình vui lòng tham khảo các sản phẩm khác tương tự nhé. Để được hỗ trợ chi tiết hơn về sản phẩm quý khách liên hệ tổng đài miễn phí 18006601 ạ.
Cho em hỏi Samsung Galaxy Z Flip4 5G 256GB Bespoke Edition  cũ 256gb khoảng bao nhiêu ạ?,Dạ sản phẩm này bên Shop hiện tại không kinh doanh ạ. Mình vui lòng tham khảo các sản phẩm khác tương tự nhé. Để được hỗ trợ chi tiết hơn về sản phẩm quý khách liên hệ tổng đài miễn phí 18006601 ạ.
Cho em hỏi Xiaomi 13T 12GB-256GB  cũ 256gb khoảng bao nhiêu ạ?,Dạ sản phẩm này bên Shop hiện tại không kinh doanh ạ. Mình vui lòng tham khảo các sản phẩm khác tương tự nhé. Để được hỗ trợ chi tiết hơn về sản phẩm quý khách liên hệ tổng đài miễn phí 18006601 ạ.
Cho em hỏi realme 11 Pro 5G 8GB-256GB  cũ 256gb khoảng bao nhiêu ạ?,Dạ sản phẩm này bên Shop hiện tại không kinh doanh ạ. Mình vui lòng tham khảo các sản phẩm khác tương tự nhé. Để được hỗ trợ chi tiết hơn về sản phẩm quý khách liên hệ tổng đài miễn phí 18006601 ạ.
Cho em hỏi Vivo V25 Pro 5G 8GB-128GB  cũ 128gb khoảng bao nhiêu ạ?,Dạ sản phẩm này bên Shop hiện tại không kinh doanh ạ. Mình vui lòng tham khảo các sản phẩm khác tương tự nhé. Để được hỗ trợ chi tiết hơn về sản phẩm quý khách liên hệ tổng đài miễn phí 18006601 ạ.
Cho em hỏi Samsung Galaxy M34 5G 128GB  cũ 128gb khoảng bao nhiêu ạ?,Dạ sản phẩm này bên Shop hiện tại không kinh doanh ạ. Mình vui lòng tham khảo các sản phẩm khác tương tự nhé. Để được hỗ trợ chi tiết hơn về sản phẩm quý khách liên hệ tổng đài miễn phí 18006601 ạ.
Cho em hỏi Honor X9A 5G 8GB-256GB  cũ 256gb khoảng bao nhiêu ạ?,Dạ sản phẩm này bên Shop hiện tại không kinh doanh ạ. Mình vui lòng tham khảo các sản phẩm khác tương tự nhé. Để được hỗ trợ chi tiết hơn về sản phẩm quý khách liên hệ tổng đài miễn phí 18006601 ạ.
Cho em hỏi realme 11 4G 8GB-128GB  cũ 128gb khoảng bao nhiêu ạ?,Dạ sản phẩm này bên Shop hiện tại không kinh doanh ạ. Mình vui lòng tham khảo các sản phẩm khác tương tự nhé. Để được hỗ trợ chi tiết hơn về sản phẩm quý khách liên hệ tổng đài miễn phí 18006601 ạ.
Cho em hỏi Vivo V25 5G 8GB-128GB  cũ 128gb khoảng bao nhiêu ạ?,Dạ sản phẩm này bên Shop hiện tại không kinh doanh ạ. Mình vui lòng tham khảo các sản phẩm khác tương tự nhé. Để được hỗ trợ chi tiết hơn về sản phẩm quý khách liên hệ tổng đài miễn phí 18006601 ạ.
Cho em hỏi Vivo V25e 8GB - 128GB  cũ 128gb khoảng bao nhiêu ạ?,Dạ sản phẩm này bên Shop hiện tại không kinh doanh ạ. Mình vui lòng tham khảo các sản phẩm khác tương tự nhé. Để được hỗ trợ chi tiết hơn về sản phẩm quý khách liên hệ tổng đài miễn phí 18006601 ạ.
Cho em hỏi Xiaomi Redmi Note 12S 8GB-256GB  cũ 256gb khoảng bao nhiêu ạ?,Dạ sản phẩm này bên Shop hiện tại không kinh doanh ạ. Mình vui lòng tham khảo các sản phẩm khác tương tự nhé. Để được hỗ trợ chi tiết hơn về sản phẩm quý khách liên hệ tổng đài miễn phí 18006601 ạ.
Cho em hỏi Samsung Galaxy A23 5G  cũ 128gb khoảng bao nhiêu ạ?,Dạ sản phẩm này bên Shop hiện tại không kinh doanh ạ. Mình vui lòng tham khảo các sản phẩm khác tương tự nhé. Để được hỗ trợ chi tiết hơn về sản phẩm quý khách liên hệ tổng đài miễn phí 18006601 ạ.
Cho em hỏi Xiaomi Redmi Note 11S 8GB - 128GB  cũ 128gb khoảng bao nhiêu ạ?,Dạ sản phẩm này bên Shop hiện tại không kinh doanh ạ. Mình vui lòng tham khảo các sản phẩm khác tương tự nhé. Để được hỗ trợ chi tiết hơn về sản phẩm quý khách liên hệ tổng đài miễn phí 18006601 ạ.
Cho em hỏi OPPO A17 4GB-64GB  cũ 64gb khoảng bao nhiêu ạ?,Dạ sản phẩm này bên Shop hiện tại không kinh doanh ạ. Mình vui lòng tham khảo các sản phẩm khác tương tự nhé. Để được hỗ trợ chi tiết hơn về sản phẩm quý khách liên hệ tổng đài miễn phí 18006601 ạ.
Cho em hỏi Nokia C32  cũ 128gb khoảng bao nhiêu ạ?,Dạ sản phẩm này bên Shop hiện tại không kinh doanh ạ. Mình vui lòng tham khảo các sản phẩm khác tương tự nhé. Để được hỗ trợ chi tiết hơn về sản phẩm quý khách liên hệ tổng đài miễn phí 18006601 ạ.
Cho em hỏi Samsung Galaxy A05 128GB  cũ 128gb khoảng bao nhiêu ạ?,Dạ sản phẩm này bên Shop hiện tại không kinh doanh ạ. Mình vui lòng tham khảo các sản phẩm khác tương tự nhé. Để được hỗ trợ chi tiết hơn về sản phẩm quý khách liên hệ tổng đài miễn phí 18006601 ạ.
Cho em hỏi realme C30s 3GB-64GB  cũ 64gb khoảng bao nhiêu ạ?,Dạ sản phẩm này bên Shop hiện tại không kinh doanh ạ. Mình vui lòng tham khảo các sản phẩm khác tương tự nhé. Để được hỗ trợ chi tiết hơn về sản phẩm quý khách liên hệ tổng đài miễn phí 18006601 ạ.
Cho em hỏi Xiaomi Redmi A2 2GB-32GB  cũ 32gb khoảng bao nhiêu ạ?,Dạ sản phẩm này bên Shop hiện tại không kinh doanh ạ. Mình vui lòng tham khảo các sản phẩm khác tương tự nhé. Để được hỗ trợ chi tiết hơn về sản phẩm quý khách liên hệ tổng đài miễn phí 18006601 ạ.
Cho em hỏi Vivo Y02 2GB-32GB  cũ 32gb khoảng bao nhiêu ạ?,Dạ sản phẩm này bên Shop hiện tại không kinh doanh ạ. Mình vui lòng tham khảo các sản phẩm khác tương tự nhé. Để được hỗ trợ chi tiết hơn về sản phẩm quý khách liên hệ tổng đài miễn phí 18006601 ạ.
Cho em hỏi Masstel Hapi 30 4G  cũ 32gb khoảng bao nhiêu ạ?,Dạ sản phẩm này bên Shop hiện tại không kinh doanh ạ. Mình vui lòng tham khảo các sản phẩm khác tương tự nhé. Để được hỗ trợ chi tiết hơn về sản phẩm quý khách liên hệ tổng đài miễn phí 18006601 ạ.
Shop mình có bán iPhone 15 Pro Max 256GB  không?,"Dạ có ạ, Shop mình có bán iPhone 15 Pro Max 256GB  với mức giá 36490000đ."
Shop mình có bán Samsung Galaxy S22 5G 128GB  không?,"Dạ có ạ, Shop mình có bán Samsung Galaxy S22 5G 128GB  với mức giá 11990000đ."
Shop mình có bán OPPO Reno8 T 4G 256GB  không?,"Dạ có ạ, Shop mình có bán OPPO Reno8 T 4G 256GB  với mức giá 7290000đ."
Shop mình có bán Honor X8A 8GB-128GB  không?,"Dạ có ạ, Shop mình có bán Honor X8A 8GB-128GB  với mức giá 3990000đ."
Shop mình có bán Samsung Galaxy A05s 128GB  không?,"Dạ có ạ, Shop mình có bán Samsung Galaxy A05s 128GB  với mức giá 3990000đ."
Shop mình có bán OPPO Reno10 5G 256GB  không?,"Dạ có ạ, Shop mình có bán OPPO Reno10 5G 256GB  với mức giá 10490000đ."
Shop mình có bán Samsung Galaxy Z Flip4 5G 128GB  không?,"Dạ có ạ, Shop mình có bán Samsung Galaxy Z Flip4 5G 128GB  với mức giá 12990000đ."
Shop mình có bán Samsung Galaxy A34 5G  không?,"Dạ có ạ, Shop mình có bán Samsung Galaxy A34 5G  với mức giá 6990000đ."
Shop mình có bán realme C55 6GB-128GB  không?,"Dạ có ạ, Shop mình có bán realme C55 6GB-128GB  với mức giá 4390000đ."
Shop mình có bán OPPO A58 6GB-128GB  không?,"Dạ có ạ, Shop mình có bán OPPO A58 6GB-128GB  với mức giá 4690000đ."
Shop mình có bán Samsung Galaxy Z Flip5 5G 256GB  không?,"Dạ có ạ, Shop mình có bán Samsung Galaxy Z Flip5 5G 256GB  với mức giá 17990000đ."
Shop mình có bán Xiaomi 13 Lite 8GB-128GB  không?,"Dạ có ạ, Shop mình có bán Xiaomi 13 Lite 8GB-128GB  với mức giá 7990000đ."
Shop mình có bán OPPO A55 4GB-64GB  không?,"Dạ có ạ, Shop mình có bán OPPO A55 4GB-64GB  với mức giá 3390000đ."
Shop mình có bán OPPO A17k 3GB-64GB  không?,"Dạ có ạ, Shop mình có bán OPPO A17k 3GB-64GB  với mức giá 2990000đ."
Shop mình có bán Samsung Galaxy A14 4G  không?,"Dạ có ạ, Shop mình có bán Samsung Galaxy A14 4G  với mức giá 3590000đ."
Shop mình có bán Samsung Galaxy A04  không?,"Dạ có ạ, Shop mình có bán Samsung Galaxy A04  với mức giá 2390000đ."
Shop mình có bán Xiaomi Redmi 12C 4GB - 64GB  không?,"Dạ có ạ, Shop mình có bán Xiaomi Redmi 12C 4GB - 64GB  với mức giá 2590000đ."
Shop mình có bán Xiaomi Redmi 10A 3GB-64GB  không?,"Dạ có ạ, Shop mình có bán Xiaomi Redmi 10A 3GB-64GB  với mức giá 2290000đ."
Shop mình có bán realme C51 4GB-128GB  không?,"Dạ có ạ, Shop mình có bán realme C51 4GB-128GB  với mức giá 3790000đ."
Shop mình có bán Honor X7A 6GB-128GB  không?,"Dạ có ạ, Shop mình có bán Honor X7A 6GB-128GB  với mức giá 3990000đ."
Shop mình có bán Honor X6A 4GB-128GB  không?,"Dạ có ạ, Shop mình có bán Honor X6A 4GB-128GB  với mức giá 3290000đ."
Shop mình có bán Asus ROG Phone 7 16GB-512GB  không?,"Dạ có ạ, Shop mình có bán Asus ROG Phone 7 16GB-512GB  với mức giá 23990000đ."
Shop mình có bán Asus ROG Phone 6 12GB-256GB  không?,"Dạ có ạ, Shop mình có bán Asus ROG Phone 6 12GB-256GB  với mức giá 14990000đ."
Shop mình có bán Vivo Y22s 8GB-128GB  không?,"Dạ có ạ, Shop mình có bán Vivo Y22s 8GB-128GB  với mức giá 4790000đ."
Shop mình có bán Vivo Y16 4GB-128GB  không?,"Dạ có ạ, Shop mình có bán Vivo Y16 4GB-128GB  với mức giá 3790000đ."
